{
  "schemaVersion": 1,
  "id": "classic.buttons.poc",
  "profileId": "m3-classic.compose-material3-1.4.0",
  "status": "seeded",
  "family": "Buttons",
  "anchorComponentId": "button.filled",
  "sourceRefs": [
    "m3-buttons",
    "m3-design-tokens",
    "m3-states",
    "androidx-material3-1.4.0"
  ],
  "caseDimensions": {
    "components": [
      "button.text",
      "button.filled",
      "button.filled-tonal",
      "button.outlined",
      "button.elevated"
    ],
    "states": [
      "enabled",
      "disabled",
      "hovered",
      "focused",
      "pressed"
    ],
    "themes": [
      "light",
      "dark"
    ]
  },
  "cases": [
    {
      "id": "classic.buttons.button.text.enabled.light",
      "componentId": "button.text",
      "state": "enabled",
      "theme": "light",
      "classification": "MUST_MATCH",
      "assertions": []
    },
    {
      "id": "classic.buttons.button.text.enabled.dark",
      "componentId": "button.text",
      "state": "enabled",
      "theme": "dark",
      "classification": "MUST_MATCH",
      "assertions": []
    },
    {
      "id": "classic.buttons.button.text.disabled.light",
      "componentId": "button.text",
      "state": "disabled",
      "theme": "light",
      "classification": "MUST_MATCH",
      "assertions": []
    },
    {
      "id": "classic.buttons.button.text.disabled.dark",
      "componentId": "button.text",
      "state": "disabled",
      "theme": "dark",
      "classification": "MUST_MATCH",
      "assertions": []
    },
    {
      "id": "classic.buttons.button.text.hovered.light",
      "componentId": "button.text",
      "state": "hovered",
      "theme": "light",
      "classification": "MUST_MATCH",
      "assertions": []
    },
    {
      "id": "classic.buttons.button.text.hovered.dark",
      "componentId": "button.text",
      "state": "hovered",
      "theme": "dark",
      "classification": "MUST_MATCH",
      "assertions": []
    },
    {
      "id": "classic.buttons.button.text.focused.light",
      "componentId": "button.text",
      "state": "focused",
      "theme": "light",
      "classification": "MUST_MATCH",
      "assertions": []
    },
    {
      "id": "classic.buttons.button.text.focused.dark",
      "componentId": "button.text",
      "state": "focused",
      "theme": "dark",
      "classification": "MUST_MATCH",
      "assertions": []
    },
    {
      "id": "classic.buttons.button.text.pressed.light",
      "componentId": "button.text",
      "state": "pressed",
      "theme": "light",
      "classification": "MUST_MATCH",
      "assertions": []
    },
    {
      "id": "classic.buttons.button.text.pressed.dark",
      "componentId": "button.text",
      "state": "pressed",
      "theme": "dark",
      "classification": "MUST_MATCH",
      "assertions": []
    },
    {
      "id": "classic.buttons.button.filled.enabled.light",
      "componentId": "button.filled",
      "state": "enabled",
      "theme": "light",
      "classification": "MUST_MATCH",
      "assertions": []
    },
    {
      "id": "classic.buttons.button.filled.enabled.dark",
      "componentId": "button.filled",
      "state": "enabled",
      "theme": "dark",
      "classification": "MUST_MATCH",
      "assertions": []
    },
    {
      "id": "classic.buttons.button.filled.disabled.light",
      "componentId": "button.filled",
      "state": "disabled",
      "theme": "light",
      "classification": "MUST_MATCH",
      "assertions": []
    },
    {
      "id": "classic.buttons.button.filled.disabled.dark",
      "componentId": "button.filled",
      "state": "disabled",
      "theme": "dark",
      "classification": "MUST_MATCH",
      "assertions": []
    },
    {
      "id": "classic.buttons.button.filled.hovered.light",
      "componentId": "button.filled",
      "state": "hovered",
      "theme": "light",
      "classification": "MUST_MATCH",
      "assertions": []
    },
    {
      "id": "classic.buttons.button.filled.hovered.dark",
      "componentId": "button.filled",
      "state": "hovered",
      "theme": "dark",
      "classification": "MUST_MATCH",
      "assertions": []
    },
    {
      "id": "classic.buttons.button.filled.focused.light",
      "componentId": "button.filled",
      "state": "focused",
      "theme": "light",
      "classification": "MUST_MATCH",
      "assertions": []
    },
    {
      "id": "classic.buttons.button.filled.focused.dark",
      "componentId": "button.filled",
      "state": "focused",
      "theme": "dark",
      "classification": "MUST_MATCH",
      "assertions": []
    },
    {
      "id": "classic.buttons.button.filled.pressed.light",
      "componentId": "button.filled",
      "state": "pressed",
      "theme": "light",
      "classification": "MUST_MATCH",
      "assertions": []
    },
    {
      "id": "classic.buttons.button.filled.pressed.dark",
      "componentId": "button.filled",
      "state": "pressed",
      "theme": "dark",
      "classification": "MUST_MATCH",
      "assertions": []
    },
    {
      "id": "classic.buttons.button.filled-tonal.enabled.light",
      "componentId": "button.filled-tonal",
      "state": "enabled",
      "theme": "light",
      "classification": "MUST_MATCH",
      "assertions": []
    },
    {
      "id": "classic.buttons.button.filled-tonal.enabled.dark",
      "componentId": "button.filled-tonal",
      "state": "enabled",
      "theme": "dark",
      "classification": "MUST_MATCH",
      "assertions": []
    },
    {
      "id": "classic.buttons.button.filled-tonal.disabled.light",
      "componentId": "button.filled-tonal",
      "state": "disabled",
      "theme": "light",
      "classification": "MUST_MATCH",
      "assertions": []
    },
    {
      "id": "classic.buttons.button.filled-tonal.disabled.dark",
      "componentId": "button.filled-tonal",
      "state": "disabled",
      "theme": "dark",
      "classification": "MUST_MATCH",
      "assertions": []
    },
    {
      "id": "classic.buttons.button.filled-tonal.hovered.light",
      "componentId": "button.filled-tonal",
      "state": "hovered",
      "theme": "light",
      "classification": "MUST_MATCH",
      "assertions": []
    },
    {
      "id": "classic.buttons.button.filled-tonal.hovered.dark",
      "componentId": "button.filled-tonal",
      "state": "hovered",
      "theme": "dark",
      "classification": "MUST_MATCH",
      "assertions": []
    },
    {
      "id": "classic.buttons.button.filled-tonal.focused.light",
      "componentId": "button.filled-tonal",
      "state": "focused",
      "theme": "light",
      "classification": "MUST_MATCH",
      "assertions": []
    },
    {
      "id": "classic.buttons.button.filled-tonal.focused.dark",
      "componentId": "button.filled-tonal",
      "state": "focused",
      "theme": "dark",
      "classification": "MUST_MATCH",
      "assertions": []
    },
    {
      "id": "classic.buttons.button.filled-tonal.pressed.light",
      "componentId": "button.filled-tonal",
      "state": "pressed",
      "theme": "light",
      "classification": "MUST_MATCH",
      "assertions": []
    },
    {
      "id": "classic.buttons.button.filled-tonal.pressed.dark",
      "componentId": "button.filled-tonal",
      "state": "pressed",
      "theme": "dark",
      "classification": "MUST_MATCH",
      "assertions": []
    },
    {
      "id": "classic.buttons.button.outlined.enabled.light",
      "componentId": "button.outlined",
      "state": "enabled",
      "theme": "light",
      "classification": "MUST_MATCH",
      "assertions": []
    },
    {
      "id": "classic.buttons.button.outlined.enabled.dark",
      "componentId": "button.outlined",
      "state": "enabled",
      "theme": "dark",
      "classification": "MUST_MATCH",
      "assertions": []
    },
    {
      "id": "classic.buttons.button.outlined.disabled.light",
      "componentId": "button.outlined",
      "state": "disabled",
      "theme": "light",
      "classification": "MUST_MATCH",
      "assertions": []
    },
    {
      "id": "classic.buttons.button.outlined.disabled.dark",
      "componentId": "button.outlined",
      "state": "disabled",
      "theme": "dark",
      "classification": "MUST_MATCH",
      "assertions": []
    },
    {
      "id": "classic.buttons.button.outlined.hovered.light",
      "componentId": "button.outlined",
      "state": "hovered",
      "theme": "light",
      "classification": "MUST_MATCH",
      "assertions": []
    },
    {
      "id": "classic.buttons.button.outlined.hovered.dark",
      "componentId": "button.outlined",
      "state": "hovered",
      "theme": "dark",
      "classification": "MUST_MATCH",
      "assertions": []
    },
    {
      "id": "classic.buttons.button.outlined.focused.light",
      "componentId": "button.outlined",
      "state": "focused",
      "theme": "light",
      "classification": "MUST_MATCH",
      "assertions": []
    },
    {
      "id": "classic.buttons.button.outlined.focused.dark",
      "componentId": "button.outlined",
      "state": "focused",
      "theme": "dark",
      "classification": "MUST_MATCH",
      "assertions": []
    },
    {
      "id": "classic.buttons.button.outlined.pressed.light",
      "componentId": "button.outlined",
      "state": "pressed",
      "theme": "light",
      "classification": "MUST_MATCH",
      "assertions": []
    },
    {
      "id": "classic.buttons.button.outlined.pressed.dark",
      "componentId": "button.outlined",
      "state": "pressed",
      "theme": "dark",
      "classification": "MUST_MATCH",
      "assertions": []
    },
    {
      "id": "classic.buttons.button.elevated.enabled.light",
      "componentId": "button.elevated",
      "state": "enabled",
      "theme": "light",
      "classification": "MUST_MATCH",
      "assertions": []
    },
    {
      "id": "classic.buttons.button.elevated.enabled.dark",
      "componentId": "button.elevated",
      "state": "enabled",
      "theme": "dark",